<?xml version= "1.0" encoding="UTF-8" standalone="no"?>
<!DOCTYPE viaje SYSTEM "EjercicioRepaso4.2.dtd">

 <viaje>
    <nombre> Cliente </nombre>
    <apellidos> ApellidosCliente </apellidos>
    <fechaInicio> 11/12/2020 </fechaInicio>
    <fechaFin> 03/01/2021 </fechaFin>
    <origen> Madrid </origen>
    <relacionDestinos>
        <destino>
            <ciudad> nombreCiudad </ciudad>
            <hotel> nombreHotel </hotel>
            <numNoches> 3 </numNoches>
        </destino>
        <destino> 
            <ciudad> nombreCiudad </ciudad>
            <hotel> nombreHotel2 </hotel>
            <numNoches> 3 </numNoches>
        </destino>
    </relacionDestinos>
    <precioViaje> 1000 â‚¬ </precioViaje>
 </viaje>